{
  "version": 1,
  "chainId": 1,
  "mode": "fixture",
  "generatedAt": 1791547200,
  "blockNumber": 26155515,
  "blockHash": "0x1111111111111111111111111111111111111111111111111111111111111111",
  "blockTimestamp": 1791547140,
  "registryRevision": "c3642464d46a05052627a88ff5d9d372b14bb62aa8fcdb46df523e2a5fdbc37c",
  "accounts": [
    {
      "id": "ychad",
      "label": "ychad.eth",
      "address": "0xFEB4acf3df3cDEA7399794D0869ef76A6EfAff52",
      "kind": "wallet"
    },
    {
      "id": "treasury",
      "label": "treasury.ychad.eth",
      "address": "0x93A62dA5a14C80f265DAbC077fCEE437B1a0Efde",
      "kind": "wallet"
    },
    {
      "id": "robo-treasury",
      "label": "Robo Treasury",
      "address": "0xEf77cc176c748d291EfB6CdC982c5744fC7211c8",
      "kind": "wallet"
    }
  ],
  "teams": [
    {
      "id": "ylockers",
      "label": "yLockers",
      "registryTeamId": null
    },
    {
      "id": "vaults",
      "label": "Vaults",
      "registryTeamId": null
    },
    {
      "id": "curation",
      "label": "Curation",
      "registryTeamId": null
    },
    {
      "id": "dao-ops",
      "label": "DAO Ops",
      "registryTeamId": null
    }
  ],
  "holdings": [
    {
      "id": "ychad-yfi",
      "accountId": "ychad",
      "positionKey": null,
      "asset": {
        "chainId": 1,
        "address": "0x0bc529c00C6401aEF6D220BE8C6Ea1667F6Ad93e",
        "symbol": "YFI",
        "name": "YFI",
        "decimals": 18
      },
      "balanceRaw": "1200000000000000000000",
      "underlying": null,
      "valuation": {
        "usdValue": "6000000",
        "usdValueExcludingYfi": "0",
        "source": "Fixture valuation",
        "asOf": 1791547140,
        "status": "current"
      },
      "purpose": "strategic",
      "purposeNote": "Held for strategic use.",
      "withdrawal": {
        "status": "available",
        "note": null
      },
      "accountableTeamId": null
    },
    {
      "id": "ychad-usdc",
      "accountId": "ychad",
      "positionKey": null,
      "asset": {
        "chainId": 1,
        "address": "0xA0b86991c6218b36c1d19D4a2e9Eb0cE3606eB48",
        "symbol": "USDC",
        "name": "USDC",
        "decimals": 6
      },
      "balanceRaw": "850000000000",
      "underlying": null,
      "valuation": {
        "usdValue": "850000",
        "usdValueExcludingYfi": "850000",
        "source": "Fixture valuation",
        "asOf": 1791547140,
        "status": "current"
      },
      "purpose": "operating",
      "purposeNote": null,
      "withdrawal": {
        "status": "available",
        "note": null
      },
      "accountableTeamId": null
    },
    {
      "id": "treasury-yvusd",
      "accountId": "treasury",
      "positionKey": "yvusd-seed",
      "asset": {
        "chainId": 1,
        "address": "0x696d02Db93291651ED510704c9b286841d506987",
        "symbol": "yvUSD",
        "name": "yvUSD",
        "decimals": 6
      },
      "balanceRaw": "999319223819",
      "underlying": {
        "asset": {
          "chainId": 1,
          "address": "0xA0b86991c6218b36c1d19D4a2e9Eb0cE3606eB48",
          "symbol": "USDC",
          "name": "USDC",
          "decimals": 6
        },
        "raw": "1032046889006"
      },
      "valuation": {
        "usdValue": "1032046.889006",
        "usdValueExcludingYfi": "1032046.889006",
        "source": "Fixture valuation",
        "asOf": 1791547140,
        "status": "current"
      },
      "purpose": "product-seed",
      "purposeNote": "Treasury capital supports a Yearn product.",
      "withdrawal": {
        "status": "unknown",
        "note": "Underlying value does not prove immediate withdrawal capacity."
      },
      "accountableTeamId": "vaults"
    },
    {
      "id": "treasury-flex",
      "accountId": "treasury",
      "positionKey": "flex-usdc-seed",
      "asset": {
        "chainId": 1,
        "address": "0x863687e4E9751b57F38b4B0ebA04744C72d0f7B8",
        "symbol": "yvFlexUSDC",
        "name": "yvFlexUSDC",
        "decimals": 6
      },
      "balanceRaw": "1000000000000",
      "underlying": {
        "asset": {
          "chainId": 1,
          "address": "0xA0b86991c6218b36c1d19D4a2e9Eb0cE3606eB48",
          "symbol": "USDC",
          "name": "USDC",
          "decimals": 6
        },
        "raw": "1014188935801"
      },
      "valuation": {
        "usdValue": "1014188.935801",
        "usdValueExcludingYfi": "1014188.935801",
        "source": "Fixture valuation",
        "asOf": 1791547140,
        "status": "current"
      },
      "purpose": "product-seed",
      "purposeNote": "Treasury capital supports a Yearn product.",
      "withdrawal": {
        "status": "unknown",
        "note": "Underlying value does not prove immediate withdrawal capacity."
      },
      "accountableTeamId": "vaults"
    },
    {
      "id": "robo-weth",
      "accountId": "robo-treasury",
      "positionKey": null,
      "asset": {
        "chainId": 1,
        "address": "0xC02aaA39b223FE8D0A0e5C4F27eAD9083C756Cc2",
        "symbol": "WETH",
        "name": "WETH",
        "decimals": 18
      },
      "balanceRaw": "25000000000000000000",
      "underlying": null,
      "valuation": {
        "usdValue": "75000",
        "usdValueExcludingYfi": "75000",
        "source": "Fixture valuation",
        "asOf": 1791547140,
        "status": "current"
      },
      "purpose": "operating",
      "purposeNote": null,
      "withdrawal": {
        "status": "available",
        "note": null
      },
      "accountableTeamId": null
    },
    {
      "id": "ychad-eth",
      "accountId": "ychad",
      "positionKey": null,
      "asset": {
        "chainId": 1,
        "address": null,
        "symbol": "ETH",
        "name": "Ether",
        "decimals": 18
      },
      "balanceRaw": "1000000000000000000",
      "underlying": null,
      "valuation": {
        "usdValue": "3000",
        "usdValueExcludingYfi": "3000",
        "source": "Fixture valuation",
        "asOf": 1791547140,
        "status": "current"
      },
      "purpose": "operating",
      "purposeNote": null,
      "withdrawal": {
        "status": "available",
        "note": null
      },
      "accountableTeamId": null
    }
  ],
  "allocations": [
    {
      "id": "resupply-loan",
      "title": "Resupply loan",
      "kind": "loan",
      "status": "active",
      "accountableTeamId": "ylockers",
      "counterparty": "Resupply",
      "originalFunding": [
        {
          "asset": {
            "chainId": 1,
            "address": "0xf939e0a03fb07f59a73314e73794be0e57ac1b4e",
            "symbol": "crvUSD",
            "name": "crvUSD",
            "decimals": 18
          },
          "raw": "1130000000000000000000000"
        }
      ],
      "originalFundingNote": "Principal denominated in crvUSD; funded using vault shares.",
      "plannedFunding": [],
      "expectedReturn": {
        "amounts": [],
        "terms": "confirmed",
        "note": null
      },
      "outstanding": {
        "amounts": [
          {
            "asset": {
              "chainId": 1,
              "address": "0xf939e0a03fb07f59a73314e73794be0e57ac1b4e",
              "symbol": "crvUSD",
              "name": "crvUSD",
              "decimals": 18
            },
            "raw": "326715095021527855501651"
          }
        ],
        "asOf": 1791547140,
        "sourceKind": "onchain",
        "note": "Fixture debt includes accrued interest."
      },
      "note": "Contract debt includes accrued interest. Repayments include interest and must not be subtracted directly from original principal.",
      "evidence": [
        {
          "label": "Approval",
          "url": "https://gov.yearn.fi/t/yip-86-resupply-bad-debt-repayment-loan/14516"
        },
        {
          "label": "Position",
          "url": "https://etherscan.io/address/0x4c0ffc2b96f3c6b048ef85d1a4744c8e36b5b6f6#readContract"
        }
      ]
    },
    {
      "id": "sherlock-bounty-deposit",
      "title": "Sherlock bounty deposit",
      "kind": "deposit",
      "status": "active",
      "accountableTeamId": "curation",
      "counterparty": "Sherlock",
      "originalFunding": [
        {
          "asset": {
            "chainId": 1,
            "address": "0xBe53a109b494E5c9f97B9cd39fE969BE68Bf6204",
            "symbol": "yvUSDC-1",
            "name": "yvUSDC-1",
            "decimals": 6
          },
          "raw": "24280687336"
        }
      ],
      "originalFundingNote": "Original deposit was approximately 25,000 USDC equivalent, transferred as vault shares.",
      "plannedFunding": [],
      "expectedReturn": {
        "amounts": [],
        "terms": "unknown",
        "note": null
      },
      "outstanding": {
        "amounts": null,
        "asOf": null,
        "sourceKind": "unavailable",
        "note": "A current amount has not been established in this registry."
      },
      "note": "Recoverable bounty deposit. The refundable amount is not yet confirmed.",
      "evidence": [
        {
          "label": "Approval",
          "url": "https://github.com/yearn/chief-multisig-officer/pull/1460"
        },
        {
          "label": "Position",
          "url": "https://etherscan.io/address/0x666B8EbFbF4D5f0CE56962a25635CfF563F13161"
        },
        {
          "label": "Original funding",
          "url": "https://etherscan.io/tx/0x3e045ced19590db8905d8a69c2f0fd0acd4f90301cf6356742e735cd7caa0964"
        }
      ]
    },
    {
      "id": "aerodrome-liquidity-loan",
      "title": "Aerodrome liquidity loan",
      "kind": "loan",
      "status": "active",
      "accountableTeamId": "ylockers",
      "counterparty": "yLockers",
      "originalFunding": [
        {
          "asset": {
            "chainId": 1,
            "address": "0x0bc529c00C6401aEF6D220BE8C6Ea1667F6Ad93e",
            "symbol": "YFI",
            "name": "YFI",
            "decimals": 18
          },
          "raw": "33000000000000000000"
        },